{"reviewer":{"system":"Codex CLI independent evaluator","model":"GPT-5","separate_process":true,"blinded_to_prior_grades":true,"conflicts":[],"hidden_materials_accessed":false,"materials_accessed":["package/instruction.md","package/task.json","package/task.toml","input/README_input.md","input/analysis_constants.json","input/metadata.csv","12 raw input/curves/*.csv files","output/analysis.py","output/polarization_parameters_by_curve.csv","output/tafel_fit_windows.csv","output/sample_corrosion_summary.csv","output/corrosion_report.md","output/polarization_curves.png","output/corrosion_metrics_summary.png","validation/validate_outputs.py","validation/VALIDATION_RESULTS.json","reproduction/fresh_env_rebuild.sh","reproduction/REPRODUCTION_LOG.md","README.md","requirements.txt","MANIFEST.sha256"]},"score":94,"verdict":"PASS","artifact_complete":true,"reproducibility":{"central_results_recomputed":true,"fresh_environment_rerun":false,"assessment":"Using a separate read-only Python calculation based directly on metadata.csv, analysis_constants.json, and all 12 raw curves, I independently recomputed the SHE conversion, area normalization, zero crossing, two OLS Tafel fits, line intersection, beta values, corrosion rate, sustained-threshold Epit, and grouped means/sample SDs. All per-curve values agreed with the delivered CSV after six-decimal rounding; maximum absolute CSV discrepancy was 4.94e-7. Independently obtained group means included icorr=0.719279, 0.322716, 0.133741, and 0.056864 µA/cm² and Epit=0.564182, 0.717560, 0.885609, and 1.032255 V SHE in the reported condition order. The snapshot is read-only, so I did not execute the artifact-producing fresh-environment workflow. The preserved reproduction log reports a newly created pinned virtual environment, 305 validator checks, and byte-identical hashes for all six scientific artifacts. Inspection of the bundled validator shows that it reimplements the calculations rather than importing analysis.py, although its PASS alone was not treated as proof."},"findings":[{"id":"F1","severity":"S1","title":"QC report understates the total number of raw samples","evidence":"output/corrosion_report.md:69 says “All 12 curves: 836 samples,” but every raw curve has 836 data rows (837 lines including its header), for 10,032 observations across 12 curves. The intended statement was evidently 836 samples per curve. This does not affect any calculation.","required_result_affected":false,"principal_conclusion_affected":false},{"id":"F2","severity":"S1","title":"Cross-metric claim about condition differences is unsupported and directionally misleading on a relative scale","evidence":"output/corrosion_report.md:133-135 claims the surfaces differ “far more” in pitting potentials than passive current densities. The reported means span 0.5642–1.0323 V for Epit (1.83-fold) but 0.570–5.983 µA/cm² for ipass (10.5-fold). Comparing raw spreads across different units is not meaningful, while the relative spread gives the opposite impression. The individual values and resistance rankings remain correct.","required_result_affected":false,"principal_conclusion_affected":false},{"id":"F3","severity":"S1","title":"Polarization figure clips high-current portions of several supplied curves","evidence":"output/analysis.py:329 fixes the semilog limit at 1e9 µA/cm². In the attached polarization_curves.png, the blue and red curves visibly run into and beyond the upper frame, so their high-current endpoints are not shown. Axes, units, threshold, condition colors, replicate styles, and the scientifically important corrosion/passive/pitting regions remain legible.","required_result_affected":false,"principal_conclusion_affected":false}],"severity_counts":{"S0":0,"S1":3,"S2":0,"S3":0},"principal_conclusion_changes":false,"required_result_changes":false,"primary_endpoint_pass":1,"primary_endpoint_rationale":"There are no S2 or S3 findings; all required artifacts are present; central numerical results independently reproduce from raw inputs; preserved fresh-environment evidence is specific and internally consistent; and the disclosed autonomous pre-freeze provenance contains no evidence of undisclosed scientific assistance. The three findings are minor reporting/visualization deficiencies only.","correction_required":true,"overall_summary":"The analysis is scientifically sound and complete. Independent recomputation confirms the Tafel parameters, corrosion rates, sustained-threshold pitting potentials—including rejection of the LPBF_AS_BUILT_R2 transient—and sample statistics. Both required figures are readable and scientifically interpretable, though the polarization plot clips some high-current tails. Corrections are limited to two report statements and the plot ceiling; no required result or principal conclusion changes."}